"ID","Name","Phone Number","Message","Date Time","Received","Sent","Status",
"111","VM-NHPSMS ","VM-NHPSMS ","-","-","-","-","-",
"1655884019700",,,"Received","2022-06-22 13:16:59","Your OTP to register/access CoWIN is 418035. It will be valid for 3 minutes. - CoWIN",,,
"1655885440498",,,"Received","2022-06-22 13:40:40","Dear Sandipan Dutta, You have successfully been vaccinated with your Precaution Dose with COVISHIELD on 22-06-2022 at 01:40 PM. You may download your vaccination Certificate from - https://cowin.gov.in - CoWIN",,,
"1655886287472",,,"Received","2022-06-22 13:54:47","Your OTP to register/access CoWIN is 905531. It will be valid for 3 minutes. - CoWIN",,,
"1655893593657",,,"Received","2022-06-22 15:56:33","Dear Sandipan Dutta, You are eligible and may avail precaution dose at private vaccination center on 19-06-2022. Please visit cowin.gov.in  CoWIN",,,
