"ID","Name","Phone Number","Message","Date Time","Received","Sent","Status",
"947","JM-JIOURG ","JM-JIOURG ","-","-","-","-","-",
"1687860430736",,,"Received","2023-06-27 15:37:10","Your bill dated 21-06-2023 for Jio Number 8451858240 is due for payment on 30-06-2023.
To know your bill amount and to pay your bill through MyJio app, click https://www.jio.com/billpay
Overdue charges will be applicable, in case of delay in payment. Kindly ignore, if already paid.
For any clarification, you can call us at 199 from your Jio number.",,,
