"ID","Name","Phone Number","Message","Date Time","Received","Sent","Status",
"3","VM-ViCARE ","VM-ViCARE ","-","-","-","-","-",
"1663210119952",,,"Received","2022-09-15 08:18:39","Alert!Outgoing Calls/Data/SMS on Vi no. 9930553060 have STOPPED.To restart,recharge with Unlimited/Combo bit.ly/Vi121NAT or dial*121# .Ignore if done",,,
"1663217829154",,,"Received","2022-09-15 10:27:09","Vi की सुपीरियर कॉल क्वालिटी और फास्ट कॉल कनेक्ट को बिना किसी अतिरिक्त शुल्क के पाइये VoLTE के साथ। 

VoLTE एक्टिवेट करने के लिए अपने स्मार्टफोन के सेटिंग्स में जाएं और नेटवर्क या सिम सेटिंग्स का चयन करें, फिर VoLTE कॉल्स और 4G का चयन करें। क्लिक bit.ly/ViVoLTE",,,
"1663248807775",,,"Received","2022-09-15 19:03:27","Rs99 recharged! Enjoy Rs99 Limited Validity Talktime+All Local/National Calls at 2.5p/sec+200MB Data.Valid for 28Days.No Outgoing SMS.For best offers dial *121#",,,
